,Paragraph
177,"Wir haben nämlich gesehen: daß alles, was der Verstand aus sich selbst
schöpft, ohne es von der Erfahrung zu borgen, das habe er dennoch
zu keinem anderen Behuf, als lediglich zum Erfahrungsgebrauch. Die
Grundsätze des reinen Verstandes, sie mögen nun a priori konstitutiv
sein (wie die mathematischen), oder bloß regulativ (wie die
dynamischen), enthalten nichts als gleichsam nur das reine Schema
zur möglichen Erfahrung; denn diese hat ihre Einheit nur von der
synthetischen Einheit, welche der Verstand der Synthesis der
Einbildungskraft in Beziehung auf die Apperzeption ursprünglich
und von selbst erteilt, und auf welche die Erscheinungen, als data
zu einem möglichen Erkenntnisse, schon a priori in Beziehung und
Einstimmung stehen müssen. Ob nun aber gleich diese Verstandesregeln
nicht allein a priori wahr sind, sondern sogar der Quell aller
Wahrheit, d.i.# der Übereinstimmung unserer Erkenntnis mit Objekten,
dadurch, daß sie den Grund der Möglichkeit der Erfahrung, als des
Inbegriffes aller Erkenntnis, darin uns Objekte gegeben werden mögen,
in sich enthalten, so scheint es uns doch nicht genug, sich bloß
dasjenige vortragen zu lassen, was wahr ist, sondern, was man zu
wissen begehrt. Wenn wir also durch diese kritische Untersuchung
nichts Mehreres lernen, als was wir im bloß empirischen Gebrauche des
Verstandes, auch ohne so subtile Nachforschung, von selbst wohl würden
ausgeübt haben, so scheint es, sei der Vorteil, den man aus ihr zieht,
den Aufwand und die Zurüstung nicht wert. Nun kann man zwar hierauf
antworten: daß kein Vorwitz der Erweiterung unserer Erkenntnis
nachteiliger sei, als der, so den Nutzen jederzeit zum voraus wissen
will, ehe man sich auf Nachforschungen einläßt, und ehe man noch sich
den mindesten Begriff von diesem Nutzen machen könnte, wenn derselbe
auch vor Augen gestellt würde. Allein es gibt doch einen Vorteil,
der auch dem schwierigsten und unlustigsten Lehrlinge solcher
transzendentalen Nachforschung begreiflich, und zugleich angelegen
gemacht werden kann, nämlich dieser: daß der bloß mit seinem
empirischen Gebrauche beschäftigte Verstand, der über die Quellen
seiner eigenen Erkenntnis nicht nachsinnt, zwar sehr gut fortkommen,
eines aber gar nicht leisten könne, nämlich, sich selbst die Grenzen
seines Gebrauchs zu bestimmen, und zu wissen, was innerhalb oder
außerhalb seiner ganzen Sphäre liegen mag; denn dazu werden eben die
tiefen Untersuchungen erfordert, die wir angestellt haben. Kann er
aber nicht unterscheiden, ob gewisse Fragen in seinem Horizonte
liegen, oder nicht, so ist er niemals seiner Ansprüche und seines
Besitzes sicher, sondern darf sich nur auf vielfältige beschämende
Zurechtweisungen Rechnung machen, wenn er die Grenzen seines Gebiets
(wie es unvermeidlich ist) unaufhörlich überschreitet, und sich in
Wahn und Blendwerke verirrt."
178,"Daß also der Verstand von allen seinen Grundsätzen a priori, ja von
allen seinen Begriffen keinen anderen als empirischen, niemals aber
einen transzendentalen Gebrauch machen könne, ist ein Satz, der,
wenn er mit Überzeugung erkannt werden kann, in wichtige Folgen
hinaussieht. Der transzendentale Gebrauch eines Begriffs in
irgendeinem Grundsatze ist dieser: daß er auf Dinge überhaupt und an
sich selbst, der empirische aber, wenn er bloß auf Erscheinungen, d.i.#
Gegenstände einer möglichen Erfahrung, bezogen wird. Daß aber überall
nur der letztere stattfinden könne, ersieht man daraus. Zu jedem
Begriff wird erstlich die logische Form eines Begriffs (des Denkens)
überhaupt, und dann zweitens auch die Möglichkeit, ihm einen
Gegenstand zu geben, darauf er sich beziehe, erfordert. Ohne diesen
letzteren hat er keinen Sinn, und ist völlig leer an Inhalt, ob er
gleich noch immer die logische Funktion enthalten mag, aus etwaigen
datis einen Begriff zu machen. Nun kann der Gegenstand einem Begriffe
nicht anders gegeben werden, als in der Anschauung, und, wenn eine
reine Anschauung noch vor dem Gegenstande a priori möglich ist, so
kann doch auch diese selbst ihren Gegenstand, mithin die objektive
Gültigkeit, nur durch die empirische Anschauung bekommen, wovon sie
die bloße Form ist. Also beziehen sich alle Begriffe und mit ihnen
alle Grundsätze, so sehr sie auch a priori möglich sein mögen, dennoch
auf empirische Anschauungen, d.i.# auf data zur möglichen Erfahrung.
Ohne dieses haben sie gar keine objektive Gültigkeit, sondern sind
ein bloßes Spiel, es sei der Einbildungskraft, oder des Verstandes,
respektive mit ihren Vorstellungen. Man nehme nur die Begriffe
der Mathematik zum Beispiele, und zwar erstlich in ihren reinen
Anschauungen. Der Raum hat drei Abmessungen, zwischen zwei Punkten
kann nur eine gerade Linie sein, usw. Obgleich alle diese Grundsätze,
und die Vorstellung des Gegenstandes, womit sich jene Wissenschaft
beschäftigt, völlig a priori im Gemüt erzeugt werden, so würden sie
doch gar nichts bedeuten, könnten wir nicht immer an Erscheinungen
(empirischen Gegenständen) ihre Bedeutung darlegen. Daher erfordert
man auch, einen abgesonderten Begriff sinnlich zu machen, d.i.# das
ihm korrespondierende Objekt in der Anschauung darzulegen, weil, ohne
dieses, der Begriff (wie man sagt) ohne Sinn, d.i.# ohne Bedeutung
bleiben würde. Die Mathematik erfüllt diese Forderung durch die
Konstruktion der Gestalt, welche eine den Sinnen gegenwärtige (obzwar
a priori zustande gebrachte) Erscheinung ist. Der Begriff der Größe
sucht in eben der Wissenschaft seine Haltung und Sinn in der Zahl,
diese aber an den Fingern, den Korallen des Rechenbretts, oder den
Strichen und Punkten, die vor Augen gestellt werden. Der Begriff
bleibt immer a priori erzeugt, samt den synthetischen Grundsätzen
oder Formeln aus solchen Begriffen; aber der Gebrauch derselben, und
Beziehung auf angebliche Gegenstände kann am Ende doch nirgend, als in
der Erfahrung gesucht werden, deren Möglichkeit (der Form nach) jene a
priori enthalten."
179,"Daß dieses aber auch der Fall mit allen Kategorien, und den daraus
gesponnenen Grundsätzen sei, erhellt auch daraus: daß wir so gar keine
einzige derselben real definieren, d.i.# die Möglichkeit ihres Objekts
verständlich machen können, ohne uns sofort zu Bedingungen der
Sinnlichkeit, mithin der Form der Erscheinungen, herabzulassen, als
auf welche, als ihre einzigen Gegenstände, sie folglich eingeschränkt
sein müssen, weil, wenn man diese Bedingung wegnimmt, alle Bedeutung,
d.i.# Beziehung aufs Objekt, wegfällt, und man durch kein Beispiel
sich selbst faßlich machen kann, was unter dergleichen Begriffe denn
eigentlich für ein Ding gemeint sei."
180,"Den Begriff der Größe überhaupt kann niemand erklären, als etwa so:
daß sie die Bestimmung eines Dinges sei, dadurch, wie vielmal Eines in
ihm gesetzt ist, gedacht werden kann. Allein dieses Wievielmal gründet
sich auf die sukzessive Wiederholung, mithin auf die Zeit und die
Synthesis (des Gleichartigen) in derselben. Realität kann man im
Gegensatze mit der Negation nur alsdann erklären, wenn man sich eine
Zeit (als den Inbegriff von allem Sein) gedenkt, die entweder womit
erfüllt, oder leer ist. Lasse ich die Beharrlichkeit (welche ein
Dasein zu aller Zeit ist) weg, so bleibt mir zum Begriffe der Substanz
nichts übrig, als die logische Vorstellung vom Subjekt, welche ich
dadurch zu realisieren vermeine, daß ich mir Etwas vorstelle, welches
bloß als Subjekt (ohne wovon ein Prädikat zu sein) stattfinden kann.
Aber nicht allein, daß ich gar keine Bedingungen weiß, unter welchen
denn dieser logische Vorzug irgendeinem Dinge eigen sein werde: so
ist auch gar nichts weiter daraus zu machen, und nicht die mindeste
Folgerung zu ziehen, weil dadurch gar kein Objekt des Gebrauchs dieses
Begriffs bestimmt wird, und man also gar nicht weiß, ob dieser überall
irgend etwas bedeute. Vom Begriffe der Ursache würde ich (wenn ich die
Zeit weglasse, in der etwas auf etwas anderes nach einer Regel folgt,)
in der reinen Kategorie nichts weiter finden, als daß es so etwas
sei, woraus sich auf das Dasein eines anderen schließen läßt, und es
würde dadurch nicht allein Ursache und Wirkung gar nicht voneinander
unterschieden werden können, sondern weil dieses Schließenkönnen doch
bald Bedingungen erfordert, von denen ich nichts weiß, so würde der
Begriff gar keine Bestimmung haben, wie er auf irgendein Objekt passe.
Der vermeinte Grundsatz: alles Zufällige hat eine Ursache, tritt zwar
ziemlich gravitätisch auf, als habe er seine eigene Würde in sich
selbst. Allein, frage ich: was versteht ihr unter Zufällig? und ihr
antwortet, dessen Nichtsein möglich ist, so möchte ich gern wissen,
woran ihr diese Möglichkeit des Nichtseins erkennen wollt, wenn ihr
euch nicht in der Reihe der Erscheinungen eine Sukzession und in
dieser ein Dasein, welches auf das Nichtsein folgt, (oder umgekehrt,)
mithin einen Wechsel vorstellt; denn, daß das Nichtsein eines Dinges
sich selbst nicht widerspreche, ist eine lahme Berufung auf eine
logische Bedingung, die zwar zum Begriffe notwendig, aber zur realen
Möglichkeit bei weitem nicht hinreichend ist; wie ich denn eine jede
existierende Substanz in Gedanken aufheben kann, ohne mir selbst zu
widersprechen, daraus aber auf die objektive Zufälligkeit derselben in
ihrem Dasein, d.i.# die Möglichkeit seines Nichtseins an sich selbst,
gar nicht schließen kann. Was den Begriff der Gemeinschaft betrifft,
so ist leicht zu ermessen: daß, da die reinen Kategorien der Substanz
sowohl, als Kausalität, keine das Objekt bestimmende Erklärung
zulassen, die wechselseitige Kausalität in der Beziehung der
Substanzen aufeinander (commercium) ebensowenig derselben fähig sei.
Möglichkeit, Dasein und Notwendigkeit hat noch niemand anders als
durch offenbare Tautologie erklären können, wenn man ihre Definition
lediglich aus dem reinen Verstande schöpfen wollte. Denn das
Blendwerk, die logische Möglichkeit des Begriffs (da er sich selbst
nicht widerspricht) der transzendentalen Möglichkeit der Dinge (da
dem Begriff ein Gegenstand korrespondiert) zu unterschieben, kann nur
Unversuchte hintergehen und zufrieden stellen*."
181,"* Mit einem Worte, alle diese Begriffe lassen sich durch nichts
  belegen, und dadurch ihre reale Möglichkeit dartun, wenn alle
  sinnliche Anschauung (die einzige, die wir haben), weggenommen wird,
  und es bleibt dann nur noch die logische Möglichkeit übrig, d.i.# daß
  der Begriff (Gedanke) möglich sei, wovon aber nicht die Rede ist,
  sondern ob er sich auf ein Objekt beziehe, und also irgend was
  bedeute."
182,"Hierzu fließt nun unwidersprechlich: daß die reinen Verstandesbegriffe
niemals von transzendentalem, sondern jederzeit nur von empirischem
Gebrauche sein können, und daß die Grundsätze des reinen Verstandes
nur in Beziehung auf die allgemeinen Bedingungen einer möglichen
Erfahrung, auf Gegenstände der Sinne, niemals aber auf Dinge
überhaupt, (ohne Rücksicht auf die Art zu nehmen, wie wir sie
anschauen mögen,) bezogen werden können."
183,"Die transzendentale Analytik hat demnach dieses wichtige Resultat: daß
der Verstand a priori niemals mehr leisten könne, als die Form einer
möglichen Erfahrung überhaupt zu antizipieren, und, da dasjenige, was
nicht Erscheinung ist, kein Gegenstand der Erfahrung sein kann, daß er
die Schranken der Sinnlichkeit, innerhalb denen uns allein Gegenstände
gegeben werden, niemals überschreiten könne. Seine Grundsätze sind
bloß Prinzipien der Exposition der Erscheinungen, und der stolze Name
einer Ontologie, welche sich anmaßt, von Dingen überhaupt synthetische
Erkenntnisse a priori in einer systematischen Doktrin zu geben (z.
E. den Grundsatz der Kausalität) muß dem bescheidenen, einer bloßen
Analytik des reinen Verstandes, Platz machen."
184,"Das Denken ist die Handlung, gegebene Anschauung auf einen Gegenstand
zu beziehen. Ist die Art dieser Anschauung auf keinerlei Weise
gegeben, so ist der Gegenstand bloß transzendental, und der
Verstandesbegriff hat keinen anderen, als transzendentalen Gebrauch,
nämlich die Einheit des Denkens eines Mannigfaltigen überhaupt.
Durch eine reine Kategorie nun, in welcher von aller Bedingung
der sinnlichen Anschauung, als der einzigen, die uns möglich ist,
abstrahiert wird, wird also kein Objekt bestimmt, sondern nur das
Denken eines Objekts überhaupt, nach verschiedenen modis, ausgedrückt.
Nun gehört zum Gebrauche eines Begriffs noch eine Funktion der
Urteilskraft, worauf ein Gegenstand unter ihm subsumiert wird, mithin
die wenigstens formale Bedingung, unter der etwas in der Anschauung
gegeben werden kann. Fehlt diese Bedingung der Urteilskraft, (Schema)
so fällt alle Subsumtion weg; denn es wird nichts gegeben, was unter
den Begriff subsumiert werden könne. Der bloß transzendentale Gebrauch
also der Kategorien ist in der Tat gar kein Gebrauch, und hat keinen
bestimmten, oder auch nur, der Form nach, bestimmbaren Gegenstand.
Hieraus folgt, daß die reine Kategorie auch zu keinem synthetischen
Grundsatze a priori zulange, und daß die Grundsätze des reinen
Verstandes nur von empirischem, niemals aber von transzendentalem
Gebrauche sind, über das Feld möglicher Erfahrung hinaus aber es
überall keine synthetischen Grundsätze a priori geben könne."
185,"Es kann daher ratsam sein, sich also auszudrücken: die reinen
Kategorien, ohne formale Bedingungen der Sinnlichkeit, haben bloß
transzendentale Bedeutung, sind aber von keinem transzendentalen
Gebrauch, weil dieser an sich selbst unmöglich ist, indem ihnen alle
Bedingungen irgendeines Gebrauchs (in Urteilen) abgehen, nämlich
die formalen Bedingungen der Subsumtion irgendeines angeblichen
Gegenstandes unter diese Begriffe. Da sie also (als bloß reine
Kategorien) nicht von empirischem Gebrauche sein sollen, und von
transzendentalem nicht sein können, so sind sie von gar keinem
Gebrauche, wenn man sie von aller Sinnlichkeit absondert, d.i.# sie
können auf gar keinen angeblichen Gegenstand angewandt werden;
vielmehr sind sie bloß die reine Form des Verstandesgebrauchs in
Ansehung der Gegenstände überhaupt und des Denkens, ohne doch durch
sie allein irgendein Objekt denken oder bestimmen zu können."
186,"Es liegt indessen hier eine schwer zu vermeidende Täuschung zum
Grunde. Die Kategorien gründen sich ihrem Ursprunge nach nicht auf
Sinnlichkeit, wie die Anschauungsformen, Raum und Zeit, scheinen
also eine über alle Gegenstände der Sinne erweiterte Anwendung
zu verstatten. Allein sie sind ihrerseits wiederum nichts als
Gedankenformen, die bloß das logische Vermögen enthalten, das
mannigfaltige in der Anschauung Gegebene in ein Bewußtsein a priori zu
vereinigen, und da können sie, wenn man ihnen die uns allein mögliche
Anschauung wegnimmt, noch weniger Bedeutung haben, als jene reinen
sinnlichen Formen, durch die doch wenigstens ein Objekt gegeben
wird, anstatt daß eine unserem Verstande eigene Verbindungsart des
Mannigfaltigen, wenn diejenige Anschauung, darin dieses allein gegeben
werden kann, nicht hinzukommt, gar nachts bedeutet. - Gleichwohl liegt
es doch schon in unserem Begriffe, wenn wir gewisse Gegenstände, als
Erscheinungen, Sinnenwesen (Phänomena) nennen, indem wir die Art,
wie wir sie anschauen, von ihrer Beschaffenheit an sich selbst
unterscheiden, daß wir entweder eben dieselbe nach dieses letzteren
Beschaffenheit, wenn wir sie gleich in derselben nicht anschauen, oder
auch andere mögliche Dinge, die gar nicht Objekte unserer Sinne sind,
als Gegenstände bloß durch den Verstand gedacht, jenen gleichsam
gegenüberstellen, und sie Verstandeswesen (Noumena) nennen. Nun frägt
sich: ob unsere reinen Verstandesbegriffe nicht in Ansehung dieser
Letzteren Bedeutung haben, und eine Erkenntnisart derselben sein
könnten?"
187,"Gleich anfangs aber zeigt sich hier eine Zweideutigkeit, welche großen
Mißverstand veranlassen kann: daß, da der Verstand, wenn er einen
Gegenstand in einer Beziehung bloß Phänomen nennt, er sich zugleich
außer dieser Beziehung noch eine Vorstellung von einem Gegenstande an
sich selbst macht, und sich daher vorstellt, er könne sich auch von
dergleichen Gegenstande Begriffe machen, und, da der Verstand keine
anderen als die Kategorien liefert, der Gegenstand in der letzteren
Bedeutung wenigstens durch diese reinen Verstandesbegriffe müsse
gedacht werden können, dadurch aber verleitet wird, den ganz
unbestimmten Begriff von einem Verstandeswesen, als einem Etwas
überhaupt außer unserer Sinnlichkeit, für einen bestimmten Begriff von
einem Wesen, welches wir durch den Verstand auf einige Art erkennen
können, zu halten."
188,"Wenn wir unter Noumenon ein Ding verstehen, so fern es nicht
Objekt unserer sinnlichen Anschauung ist, indem wir von unserer
Anschauungsart desselben abstrahieren; so ist dieses ein Noumenon
im negativen Verstande. Verstehen wir aber darunter ein Objekt
einer nichtsinnlichen Anschauung, so nehmen wir eine besondere
Anschauungsart an, nämlich die intellektuelle, die aber nicht die
unsrige ist, von welcher wir auch die Möglichkeit nicht einsehen
können, und das wäre das Noumenon in positiver Bedeutung."
189,"Die Lehre von der Sinnlichkeit ist nun zugleich die Lehre von den
Noumenen im negativen Verstande, d.i.# von Dingen, die der Verstand
sich ohne diese Beziehung auf unsere Anschauungsart, mithin nicht bloß
als Erscheinungen, sondern als Dinge an sich selbst denken muß, von
denen er aber in dieser Absonderung zugleich begreift, daß er von
seinen Kategorien in dieser Art sie zu erwägen, keinen Gebrauch machen
könne, weil diese nur in Beziehung auf die Einheit der Anschauungen
in Raum und Zeit Bedeutung haben, sie eben diese Einheit auch nur
wegen der bloßen Idealität des Raums und der Zeit durch allgemeine
Verbindungsbegriffe a priori bestimmen können. Wo diese Zeiteinheit
nicht angetroffen werden kann, mithin beim Noumenon, da hört der ganze
Gebrauch, ja selbst alle Bedeutung der Kategorien völlig auf; denn
selbst die Möglichkeit der Dinge, die den Kategorien entsprechen
sollen, läßt sich gar nicht einsehen; weshalb ich mich nur auf das
berufen darf, was ich in der allgemeinen Anmerkung zum vorigen
Hauptstücke gleich zu Anfang anführte. Nun kann aber die Möglichkeit
einer Dinges niemals bloß aus dem Nichtwidersprechen eines Begriffs
desselben, sondern nur dadurch, daß man diesen durch eine ihm
korrespondierende Anschauung belegt, bewiesen werden. Wenn wir also
die Kategorien auf Gegenstände, die nicht als Erscheinungen betrachtet
werden, anwenden wollten, so müßten wir eine andere Anschauung, als
die sinnliche, zum Grunde legen, und alsdann wäre der Gegenstand
ein Noumenon in positiver Bedeutung. Da nun eine solche, nämlich
die intellektuelle Anschauung, schlechterdings außer unserem
Erkenntnisvermögen liegt, so kann auch der Gebrauch der Kategorien
keineswegs über die Grenze der Gegenstände der Erfahrung
hinausreichen, und den Sinnenwesen korrespondieren zwar freilich
Verstandeswesen, auch mag es Verstandeswesen geben, auf welche unser
sinnliches Anschauungsvermögen gar keine Beziehung hat, aber unsere
Verstandesbegriffe, als bloße Gedankenformen für unsere sinnliche
Anschauung, reichen nicht im mindesten auf diese hinaus; was also
von uns Noumenon genannt wird, muß als ein solches nur in negativer
Bedeutung verstanden werden."
190,"Wenn ich alles Denken (durch Kategorien) aus einer empirischen
Erkenntnis wegnehme, so bleibt gar keine Erkenntnis irgendeines
Gegenstandes übrig; denn durch bloße Anschauung wird gar nichts
gedacht, und, daß diese Affektion der Sinnlichkeit in mir ist, macht
gar keine Beziehung von dergleichen Vorstellung auf irgend ein Objekt
aus. Lasse ich aber hingegen alle Anschauung weg, so bleibt doch noch
die Form des Denkens, d.i.# die Art, dem Mannigfaltigen einer möglichen
Anschauung einen Gegenstand zu bestimmen. Daher erstrecken sich die
Kategorien sofern weiter, als die sinnliche Anschauung, weil sie
Objekte überhaupt denken, ohne noch auf die besondere Art (der
Sinnlichkeit) zu sehen, in der sie gegeben werden mögen. Sie bestimmen
aber dadurch nicht eine größere Sphäre von Gegenständen, weil, daß
solche gegeben werden können, man nicht annehmen kann, ohne daß man
eine andere als sinnliche Art der Anschauung als möglich voraussetzt,
wozu wir aber keineswegs berechtigt sind."
191,"Ich nenne einen Begriff problematisch, der keinen Widerspruch
enthält, der auch als eine Begrenzung gegebener Begriffe mit anderen
Erkenntnissen zusammenhängt, dessen objektive Realität aber auf keine
Weise erkannt werden kann. Der Begriff eines Noumenon, d.i.# eines
Dinges, welches gar nicht als Gegenstand der Sinne, sondern als ein
Ding an sich selbst, (lediglich durch einen reinen Verstand) gedacht
werden soll, ist gar nicht widersprechend; denn man kann von der
Sinnlichkeit doch nicht behaupten, daß sie die einzige mögliche Art
der Anschauung sei. Ferner ist dieser Begriff notwendig, um die
sinnliche Anschauung nicht bis über die Dinge an sich selbst
auszudehnen, und also, um die objektive Gültigkeit der sinnlichen
Erkenntnis einzuschränken, (denn das übrige, worauf jene nicht
reicht, heißen eben darum Noumena, damit man dadurch anzeige, jene
Erkenntnisse können ihr Gebiet nicht über alles, was der Verstand
denkt, erstrecken). Am Ende aber ist doch die Möglichkeit solcher
Noumenorum gar nicht einzusehen, und der Umfang außer der Sphäre der
Erscheinungen ist (für uns) leer, d.i.# wir haben einen Verstand, der
sich problematisch weiter erstreckt, als jene, aber keine Anschauung,
ja auch nicht einmal den Begriff von einer möglichen Anschauung,
wodurch uns außer dem Felde der Sinnlichkeit Gegenstände gegeben, und
der Verstand über dieselbe hinaus assertorisch gebraucht werden könne.
Der Begriff eines Noumenon ist also bloß ein Grenzbegriff, um die
Anmaßung der Sinnlichkeit einzuschränken, und also nur von negativem
Gebrauche. Er ist aber gleichwohl nicht willkürlich erdichtet, sondern
hängt mit der Einschränkung der Sinnlichkeit zusammen, ohne doch etwas
Positives außer dem Umfange derselben setzen zu können."
192,"Die Einteilung der Gegenstände in Phaenomena und Noumena, und der Welt
in eine Sinnen- und Verstandeswelt, kann daher in positiver Bedeutung
gar nicht zugelassen werden, obgleich Begriffe allerdings die
Einteilung in sinnliche und intellektuelle zulassen; denn man kann den
letzteren keinen Gegenstand bestimmen, und sie also auch nicht für
objektiv gültig ausgeben. Wenn man von den Sinnen abgeht, wie will
man begreiflich machen, daß unsere Kategorien (welche die einzigen
übrigbleibenden Begriffe für Noumena sein würden) noch überall etwas
bedeuten, da zu ihrer Beziehung auf irgendeinen Gegenstand noch etwas
mehr, als bloß die Einheit des Denkens, nämlich überdem eine mögliche
Anschauung gegeben sein muß, darauf jene angewandt werden können?
Der Begriff eines Noumeni, bloß problematisch genommen, bleibt
demungeachtet nicht allein zulässig, sondern, auch als ein die
Sinnlichkeit in Schranken setzender Begriff, unvermeidlich. Aber
alsdann ist das nicht ein besonderer intelligibler Gegenstand für
unseren Verstand, sondern ein Verstand, für den es gehörte, ist selbst
ein Problema, nämlich, nicht diskursiv durch Kategorien, sondern
intuitiv in einer nichtsinnlichen Anschauung seinen Gegenstand zu
erkennen, als von welchem wir uns nicht die geringste Vorstellung
seiner Möglichkeit machen können. Unser Verstand bekommt nun auf
diese Weise eine negative Erweiterung, d.i.# er wird nicht durch
die Sinnlichkeit eingeschränkt, sondern schränkt vielmehr dieselbe
ein, dadurch, daß er Dinge an sich selbst (nicht als Erscheinungen
betrachtet) Noumena nennt. Aber er setzt sich auch sofort selbst
Grenzen, sie durch keine Kategorien zu erkennen, mithin sie nur unter
dem Namen eines unbekannten Etwas zu denken."
193,"Ich finde indessen in den Schriften der Neueren einen ganz anderen
Gebrauch der Ausdrücke eines mundi sensibilis und intelligibilis*, der
von dem Sinne der Alten ganz abweicht, und wobei es freilich keine
Schwierigkeit hat, aber auch nichts als leere Wortkrämerei angetroffen
wird. Nach demselben hat es einigen beliebt, den Inbegriff der
Erscheinungen, sofern er angeschaut wird, die Sinnenwelt, sofern aber
der Zusammenhang derselben nach allgemeinen Verstandesgesetzen gedacht
wird, die Verstandeswelt zu nennen. Die theoretische Astronomie,
welche die bloße Beobachtung des bestirnten Himmels vorträgt, würde
die erstere, die kontemplative dagegen (etwa nach dem kopernikanischen
Weltsystem, oder gar nach Newtons Gravitationsgesetzen erklärt), die
zweite, nämlich eine intelligible Welt vorstellig machen. Aber eine
solche Wortverdrehung ist eine bloße sophistische Ausflucht, um einer
beschwerlichen Frage auszuweichen, dadurch, daß man ihren Sinn zu
seiner Gemächlichkeit herabstimmt. In Ansehung der Erscheinungen läßt
sich allerdings Verstand und Vernunft brauchen; aber es fragt sich,
ob diese auch noch einigen Gebrauch haben, wenn der Gegenstand nicht
Erscheinung (Noumenon) ist, und in diesem Sinne nimmt man ihn, wenn
er an sich als bloß intelligibel, d.i.# dem Verstande allein, und gar
nicht den Sinnen gegeben, gedacht wird. Es ist also die Frage: ob
außer jenem empirischen Gebrauche des Verstandes (selbst in der
Newtonischen Vorstellung des Weltbaues) noch ein transzendentaler
möglich sei, der, auf das Noumenon als einen Gegenstand gehe, welche
Frage wir verneinend beantwortet haben."
194,"* Man muß nicht, statt dieses Ausdrucks, den einer intellektuellen
  Welt, wie man im deutschen Vortrage gemeinhin zu tun pflegt,
  brauchen; denn intellektuell, oder sensitiv, sind nur die
  Erkenntnisse. Was aber nur ein Gegenstand der einen oder der anderen
  Anschauungsart sein kann, der Objekte also, müssen (unerachtet der
  Härte des Lauts) intelligibel oder sensibel heißen."
