,Paragraph
107,"Wir haben Vorstellungen in uns, deren wir uns auch bewußt werden
können. Dieses Bewußtsein aber mag so weit erstreckt, und so genau
oder pünktlich sein, als man wolle, so bleiben es doch nur immer
Vorstellungen, d.i.# innere Bestimmungen unseres Gemüts in diesem
oder jenem Zeitverhältnisse. Wie kommen wir nun dazu, daß wir diesen
Vorstellungen ein Objekt setzen, oder über ihre subjektive Realität,
als Modifikationen, ihnen noch, ich weiß nicht, was für eine,
objektive beilegen? Objektive Bedeutung kann nicht in der Beziehung
auf eine andere Vorstellung (von dem, was man vom Gegenstande nennen
wollte) bestehen, denn sonst erneuert sich die Frage: wie geht diese
Vorstellung wiederum aus sich selbst heraus, und bekommt objektive
Bedeutung noch über die subjektive, welche ihr, als Bestimmung des
Gemütszustandes, eigen ist? Wenn wir untersuchen, was denn die
Beziehung auf einen Gegenstand unseren Vorstellungen für eine neue
Beschaffenheit gebe, und welches die Dignität sei, die sie dadurch
erhalten, so finden wir, daß sie nichts weiter tue, als die Verbindung
der Vorstellungen auf eine gewisse Art notwendig zu machen, und sie
einer Regel zu unterwerfen; daß umgekehrt nur dadurch, daß eine
gewisse Ordnung in dem Zeitverhältnisse unserer Vorstellungen
notwendig ist, ihnen objektive Bedeutung erteilt wird."
108,"In der Synthesis der Erscheinungen folgt das Mannigfaltige der
Vorstellungen jederzeit nacheinander. Hiedurch wird nun gar kein
Objekt vorgestellt; weil durch diese Folge, die allen Apprehensionen
gemein ist, nichts vom anderen unterschieden wird. Sobald ich aber
wahrnehme, oder voraus annehme, daß in dieser Folge eine Beziehung auf
den vorhergehenden Zustand sei, aus welchem die Vorstellung nach einer
Regel folgt, so stellt sich etwas vor als Begebenheit, oder was da
geschieht, d.i.# ich erkenne einen Gegenstand, den ich in der Zeit
auf eine gewisse bestimmte Stelle setzen muß, die ihm, nach dem
vorhergehenden Zustande, nicht anders erteilt werden kann. Wenn ich
also wahrnehme, daß etwas geschieht, so ist in dieser Vorstellung
erstlich enthalten: daß etwas vorhergehe, weil eben in Beziehung auf
dieses die Erscheinung ihre Zeitverhältnis bekommt, nämlich, nach
einer vorhergehenden Zeit, in der sie nicht war, zu existieren. Aber
ihre bestimmte Zeitstelle in diesem Verhältnisse kann sie nur dadurch
bekommen, daß im vorhergehenden Zustande etwas vorausgesetzt wird,
worauf es jederzeit, d.i.# nach einer Regel, folgt: woraus sich denn
ergibt, daß ich erstlich nicht die Reihe umkehren, und das, was
geschieht, demjenigen voransetzen kann, worauf es folgt: zweitens
daß, wenn der Zustand, der vorhergeht, gesetzt wird, diese bestimmte
Begebenheit unausbleiblich und notwendig folge. Dadurch geschieht es:
daß eine Ordnung unter unseren Vorstellungen wird, in welcher das
Gegenwärtige (sofern es geworden) auf irgendeinen vorhergehenden
Zustand Anweisung gibt, als ein, obzwar noch unbestimmtes Korrelatum
dieser Ereignis, die gegeben ist, welches sich aber auf diese, als
seine Folge, bestimmend bezieht, und sie notwendig mit sich in der
Zeitreihe verknüpft."
109,"Wenn es nun ein notwendiges Gesetz unserer Sinnlichkeit, mithin eine
formale Bedingung aller Wahrnehmungen ist: daß die vorige Zeit die
folgende notwendig bestimmt (indem ich zur folgenden nicht anders
gelangen kann, als durch die vorhergehende); so ist es auch ein
unentbehrliches Gesetz der empirischen Vorstellung der Zeitreihe, daß
die Erscheinungen der vergangenen Zeit jedes Dasein in der folgenden
bestimmen, und daß diese, als Begebenheiten, nicht stattfinden, als
sofern jene ihnen ihr Dasein in der Zeit bestimmen, d.i.# nach einer
Regel festsetzen. Denn nur an den Erscheinungen können wir diese
Kontinuität im Zusammenhange der Zeiten empirisch erkennen."
110,"Zu aller Erfahrung und deren Möglichkeit gehört Verstand, und das
erste, was er dazu tut, ist nicht: daß er die Vorstellung der
Gegenstände deutlich macht, sondern daß er die Vorstellung eines
Gegenstandes überhaupt möglich macht. Dieses geschieht nun dadurch,
daß er die Zeitordnung auf die Erscheinungen und deren Dasein
überträgt, indem er jeder derselben als Folge eine, in Ansehung der
vorhergehenden Erscheinungen, a priori bestimmte Stelle in der Zeit
zuerkennt, ohne welche sie nicht mit der Zeit selbst, die allen ihren
Teilen a priori ihre Stelle bestimmt, übereinkommen würde. Diese
Bestimmung der Stelle kann nun nicht von dem Verhältnis der
Erscheinungen gegen die absolute Zeit entlehnt werden, (denn die ist
kein Gegenstand der Wahrnehmung,) sondern umgekehrt, die Erscheinungen
müssen einander ihre Stellen in der Zeit selbst bestimmen, und
dieselbe in der Zeitordnung notwendig machen, d.i.# dasjenige, was da
folgt, oder geschieht, muß nach einer allgemeinen Regel auf das, was
im vorigen Zustande enthalten war, folgen, woraus eine Reihe der
Erscheinungen wird, die vermittelst des Verstandes eben dieselbige
Ordnung und stetigen Zusammenhang in der Reihe möglicher Wahrnehmungen
hervorbringt, und notwendig macht, als sie in der Form der inneren
Anschauung, (der Zeit) darin alle Wahrnehmungen ihre Stelle haben
müßten, a priori angetroffen wird."
111,"Daß also etwas geschieht, ist eine Wahrnehmung, die zu einer möglichen
Erfahrung gehört, die dadurch wirklich wird, wenn ich die Erscheinung,
ihrer Stelle nach, in der Zeit, als bestimmt, mithin als ein Objekt
ansehe, welches nach einer Regel im Zusammenhange der Wahrnehmungen
jederzeit gefunden werden kann. Diese Regel aber, etwas der Zeitfolge
nach zu bestimmen, ist: daß in dem, was vorhergeht, die Bedingung
anzutreffen sei, unter welcher die Begebenheit jederzeit (d.i.#
notwendigerweise) folgt. Also ist der Satz vom zureichenden Grunde
der Grund möglicher Erfahrung, nämlich der objektiven Erkenntnis der
Erscheinungen, in Ansehung des Verhältnisses derselben, in Reihenfolge
der Zeit."
112,"Der Beweisgrund dieses Satzes aber beruht lediglich auf folgenden
Momenten. Zu aller empirischen Erkenntnis gehört die Synthesis des
Mannigfaltigen durch die Einbildungskraft, die jederzeit sukzessiv
ist; d.i.# die Vorstellungen folgen in ihr jederzeit aufeinander. Die
Folge aber ist in der Einbildungskraft der Ordnung nach (was vorgehen
und was folgen müsse) gar nicht bestimmt, und die Reihe der einen
der folgenden Vorstellungen kann ebensowohl rückwärts als vorwärts
genommen werden. Ist aber diese Synthesis eine Synthesis der
Apprehension (des Mannigfaltigen einer gegebenen Erscheinung), so ist
die Ordnung im Objekt bestimmt, oder, genauer zu reden, es ist darin
eine Ordnung der sukzessiven Synthesis, die ein Objekt bestimmt, nach
welcher etwas notwendig vorausgehen, und wenn dieses gesetzt ist,
das andere notwendig folgen müsse. Soll also meine Wahrnehmung die
Erkenntnis einer Begebenheit enthalten, da nämlich etwas wirklich
geschieht; so muß sie ein empirisches Urteil sein, in welchem man
sich denkt, daß die Folge bestimmt sei, d.i.# daß sie eine andere
Erscheinung der Zeit nach voraussetze, worauf sie notwendig, oder nach
einer Regel folgt. Widrigenfalls, wenn ich das Vorhergehende setze,
und die Begebenheit folgte nicht darauf notwendig, so würde ich sie
nur für ein subjektives Spiel meiner Einbildungen halten müssen, und
stellte ich mir darunter doch etwas Objektives vor, sie einen bloßen
Traum nennen. Also ist das Verhältnis der Erscheinungen (als möglicher
Wahrnehmungen), nach welchem das Nachfolgende (was geschieht) durch
etwas Vorhergehendes seinem Dasein nach notwendig, und nach einer
Regel in der Zeit bestimmt ist, mithin das Verhältnis der Ursache zur
Wirkung die Bedingung der objektiven Gültigkeit unserer empirischen
Urteile, in Ansehung der Reihe der Wahrnehmungen, mithin der
empirischen Wahrheit derselben, und also der Erfahrung. Der Grundsatz
des Kausalverhältnisses in der Folge der Erscheinungen gilt daher
auch vor allen Gegenständen der Erfahrung (unter den Bedingungen der
Sukzession), weil er selbst der Grund der Möglichkeit einer solchen
Erfahrung ist."
113,"Hier äußert sich aber noch eine Bedenklichkeit, die gehoben werden
muß. Der Satz der Kausalverknüpfung unter den Erscheinungen ist in
unserer Formel auf die Reihenfolge derselben eingeschränkt, da es
sich doch bei dem Gebrauch desselben findet, daß er auch auf ihre
Begleitung passe, und Ursache und Wirkung zugleich sein könne. Es ist
z.B. Wärme im Zimmer, die nicht in freier Luft angetroffen wird. Ich
sehe mich nach der Ursache um, und finde einen geheizten Ofen. Nun ist
dieser, als Ursache, mit seiner Wirkung, der Stubenwärme, zugleich;
also ist hier keine Reihenfolge, der Zeit nach, zwischen Ursache und
Wirkung, sondern sie sind zugleich, und das Gesetz gilt doch. Der
größte Teil der wirkenden Ursache in der Natur ist mit ihren Wirkungen
zugleich, und die Zeitfolge der letzteren wird nur dadurch veranlaßt,
daß die Ursache ihre ganze Wirkung nicht in einem Augenblick
verrichten kann. Aber in dem Augenblicke, da sie zuerst entsteht, ist
sie mit der Kausalität ihrer Ursache jederzeit zugleich, weil, wenn
jene einen Augenblick vorher aufgehört hätte zu sein, diese gar nicht
entstanden wäre. Hier muß man wohl bemerken, daß es auf die Ordnung
der Zeit, und nicht auf den Ablauf derselben angesehen sei; das
Verhältnis bleibt, wenngleich keine Zeit verlaufen ist. Die Zeit
zwischen der Kausalität der Ursache, und deren unmittelbaren Wirkung,
kann verschwindend (sie also zugleich) sein, aber das Verhältnis der
einen zur anderen bleibt doch immer, der Zeit nach, bestimmbar. Wenn
ich eine Kugel, die auf einem ausgestopften Kissen liegt, und ein
Grübchen darin drückt, als Ursache betrachte, so ist sie mit der
Wirkung zugleich. Allein ich unterscheide doch beide durch das
Zeitverhältnis der dynamischen Verknüpfung beider. Denn, wenn ich die
Kugel auf das Kissen lege, so folgt auf die vorige glatte Gestalt
desselben das Grübchen; hat aber das Kissen (ich weiß nicht woher) ein
Grübchen, so folgt darauf nicht eine bleierne Kugel."
114,"Demnach ist die Zeitfolge allerdings das einzige empirische Kriterium
der Wirkung, in Beziehung auf die Kausalität der Ursache, die
vorhergeht. Das Glas ist die Ursache von dem Steigen des Wassers über
seine Horizontalfläche, obgleich beide Erscheinungen zugleich sind.
Denn sobald ich dieses aus einem größeren Gefäß mit dem Glase schöpfe,
so erfolgt etwas, nämlich die Veränderung des Horizontalstandes, den
es dort hatte, in einen konkaven, den es im Glase annimmt."
115,"Diese Kausalität führt auf den Begriff der Handlung, diese auf den
Begriff der Kraft, und dadurch auf den Begriff der Substanz. Da ich
mein kritisches Vorhaben, welches lediglich auf die Quellen der
synthetischen Erkenntnis a priori geht, nicht mit Zergliederungen
bemengen will, die bloß die Erläuterung (nicht Erweiterung) der
Begriffe angehen, so überlasse ich die umständliche Erörterung
derselben einem künftigen System der reinen Vernunft: wiewohl man eine
solche Analysis im reichen Maße, auch schon in den bisher bekannten
Lehrbüchern dieser Art, antrifft. Allein das empirische Kriterium
einer Substanz, sofern sie sich nicht durch die Beharrlichkeit der
Erscheinung, sondern besser und leichter durch Handlung zu offenbaren
scheint, kann ich nicht unberührt lassen."
116,"Wo Handlung, mithin Tätigkeit und Kraft ist, da ist auch Substanz,
und in dieser allein muß der Sitz jener fruchtbaren Quelle der
Erscheinungen gesucht werden. Das ist ganz gut gesagt; aber, wenn man
sich darüber erklären soll, was man unter Substanz verstehe, und dabei
den fehlerhaften Zirkel vermeiden will, so ist es nicht so leicht
verantwortet. Wie will man aus der Behandlung sogleich auf die
Beharrlichkeit des Handelnden schließen, welches doch ein so
wesentliches und eigentümliches Kennzeichen der Substanz (phaenomenon)
ist? Allein, nach unserem vorigen hat die Auflösung der Frage doch
keine solche Schwierigkeit, ob sie gleich nach der gemeinen Art (bloß
analytisch mit seinen Begriffen zu verfahren) ganz unauflöslich
sein würde. Handlung bedeutet schon das Verhältnis des Subjekts der
Kausalität zur Wirkung. Weil nun alle Wirkung in dem besteht, was da
geschieht, mithin im Wandelbaren, was die Zeit der Sukzession nach
bezeichnet; so ist das letzte Subjekt desselben das Beharrliche, als
das Substratum alles Wechselnden, d.i.# die Substanz. Denn nach dem
Grundsatze der Kausalität sind Handlungen immer der erste Grund von
allem Wechsel der Erscheinungen, und können also nicht in einem
Subjekt liegen, was selbst wechselt, weil sonst andere Handlungen und
ein anderes Subjekt, welches diesen Wechsel bestimmte, erforderlich
wären. Kraft dessen beweist nun Handlung, als ein hinreichendes
empirisches Kriterium, die Substantialität, ohne daß ich die
Beharrlichkeit desselben durch verglichene Wahrnehmungen allererst
zu suchen nötig hätte, welches auch auf diesem Wege mit der
Ausführlichkeit nicht geschehen könnte, die zu der Größe und strengen
Allgemeingültigkeit des Begriffs erforderlich ist. Denn daß das erste
Subjekt der Kausalität alles Entstehens und Vergehens selbst nicht
(im Felde der Erscheinungen) entstehen und vergehen könne, ist ein
sicherer Schluß, der auf empirische Notwendigkeit und Beharrlichkeit
im Dasein, mithin auf den Begriff einer Substanz als Erscheinung
ausläuft."
117,"Wenn etwas geschieht, so ist das bloße Entstehen, ohne Rücksicht
auf das, was da entsteht, schon an sich selbst ein Gegenstand der
Untersuchung. Der Übergang aus dem Nichtsein eines Zustandes in diesen
Zustand, gesetzt, daß dieser auch keine Qualität in der Erscheinung
enthielte, ist schon allein nötig zu untersuchen. Dieses Entstehen
trifft, wie in der Nummer A gezeigt worden, nicht die Substanz
(denn die entsteht nicht), sondern ihren Zustand. Es ist also bloß
Veränderung, und nicht Ursprung aus Nichts. Wenn dieser Ursprung
als Wirkung von einer fremden Ursache angesehen wird, so heißt er
Schöpfung, welche als Begebenheit unter den Erscheinungen nicht
zugelassen werden kann, indem ihre Möglichkeit allein schon die
Einheit der Erfahrung aufheben würde, obzwar, wenn ich alle Dinge
nicht als Phänomene, sondern als Dinge an sich betrachte, und als
Gegenstände des bloßen Verstandes, sie, obschon sie Substanzen sind,
dennoch wie abhängig ihrem Dasein nach von fremder Ursache angesehen
werden können; welches aber alsdann ganz andere Wortbedeutungen nach
sich ziehen, und auf Erscheinungen, als mögliche Gegenstände der
Erfahrung, nicht passen würde."
118,"Wie nun überhaupt etwas verändert werden könne; wie es möglich sei,
daß auf einen Zustand in einem Zeitpunkte ein entgegengesetzter im
anderen folgen könne: davon haben wir a priori nicht den mindesten
Begriff. Hierzu wird die Kenntnis wirklicher Kräfte erfordert, welche
nur empirisch gegeben werden kann, z.B. der bewegenden Kräfte, oder,
welches einerlei ist, gewisser sukzessiver Erscheinungen, (als
Bewegungen) welche solche Kräfte anzeigen. Aber die Form einer jeden
Veränderung, die Bedingung, unter welcher sie, als ein Entstehen eines
anderen Zustandes, allein vorgehen kann, (der Inhalt derselben, d.i.#
der Zustand, der verändert wird, mag sein, welcher er wolle), mithin
die Sukzession der Zustände selbst (das Geschehene) kann doch nach dem
Gesetze der Kausalität und den Bedingungen der Zeit a priori erwogen
werden*."
119,"* Man merke wohl: daß ich nicht von der Veränderung gewisser
  Relationen überhaupt, sondern von Veränderung des Zustandes rede.
  Daher, wenn ein Körper sich gleichförmig bewegt, so verändert er
  seinen Zustand (der Bewegung) gar nicht; aber wohl, wenn seine
  Bewegung zu- und abnimmt."
120,"Wenn eine Substanz aus einem Zustande a in einen anderen b übergeht,
so ist der Zeitpunkt des zweiten vom Zeitpunkte des ersteren Zustandes
unterschieden, und folgt demselben. Ebenso ist auch der zweite Zustand
als Realität (in der Erscheinung) vom ersteren, darin diese nicht war,
wie b vom Zero unterschieden; d.i.# wenn der Zustand b sich auch von
dem Zustande a nur der Größe nach unterschiede, so ist die Veränderung
ein Entstehen von b-a, welches im vorigen Zustande nicht war, und in
Ansehung dessen er = o ist."
121,"Es frägt sich also, wie ein Ding aus einem Zustande = a in einen
anderen = b übergehe. Zwischen zwei Augenblicken ist immer eine Zeit,
und zwischen zwei Zuständen in denselben immer ein Unterschied, der
eine Größe hat, (denn alle Teile der Erscheinungen sind immer wiederum
Größen). Also geschieht jeder Übergang aus einem Zustande in den
anderen in einer Zeit, die zwischen zwei Augenblicken enthalten ist,
deren der erste den Zustand bestimmt, aus welchem das Ding herausgeht,
der zweite den, in welchen es gelangt. Beide also sind Grenzen der
Zeit einer Veränderung, mithin des Zwischenzustandes zwischen beiden
Zuständen, und gehören als solche mit zu der ganzen Veränderung. Nun
hat jede Veränderung eine Ursache, welche in der ganzen Zeit, in
welcher jene vorgeht, ihre Kausalität beweist. Also bringt diese
Ursache ihre Veränderung nicht plötzlich (auf einmal oder in einem
Augenblicke) hervor, sondern in einer Zeit, so, daß, wie die Zeit vom
Anfangsaugenblicke a bis zu ihrer Vollendung in b wächst, auch die
Größe der Realität (b-a) durch alle kleineren Grade, die zwischen dem
ersten und letzten enthalten sind, erzeugt wird. Alle Veränderung ist
also nur durch eine kontinuierliche Handlung der Kausalität möglich,
welche, sofern sie gleichförmig ist, ein Moment heißt. Aus diesen
Momenten besteht nicht die Veränderung, sondern wird dadurch erzeugt
als ihre Wirkung."
122,"Das ist nun das Gesetz der Kontinuität aller Veränderung, dessen Grund
dieser ist: daß weder die Zeit, noch auch die Erscheinung in der Zeit,
aus Teilen besteht, die die kleinsten sind, und daß doch der Zustand
des Dinges bei seiner Veränderung durch alle diese Teile, als
Elemente, zu seinem zweiten Zustande übergehe. Es ist kein Unterschied
des Realen in der Erscheinung, so wie kein Unterschied in der Größe
der Zeiten, der kleinste, und so erwächst der neue Zustand der
Realität von dem ersten an, darin diese nicht war, durch alle
unendlichen Grade derselben, deren Unterschiede voneinander insgesamt
kleiner sind, als der zwischen o und a."
123,"Welchen Nutzen dieser Satz in der Naturforschung haben möge, das geht
uns hier nichts an. Aber, wie ein solcher Satz, der unsere Erkenntnis
der Natur so zu erweitern scheint, völlig a priori möglich sei, das
erfordert gar sehr unsere Prüfung, wenngleich der Augenschein beweist,
daß er wirklich und richtig sei, und man also der Frage, wie er
möglich gewesen, überhoben zu sein glauben möchte. Denn es gibt so
mancherlei ungegründete Anmaßungen der Erweiterung unserer Erkenntnis
durch reine Vernunft: daß es zum allgemeinen Grundsatz angenommen
werden muß, deshalb durchaus mißtrauisch zu sein, und ohne Dokumente,
die eine gründliche Deduktion verschaffen können, selbst auf den
klarsten dogmatischen Beweis nichts dergleichen zu glauben und
anzunehmen."
124,"Aller Zuwachs des empirischen Erkenntnisses, und jeder Fortschritt
der Wahrnehmung ist nichts, als eine Erweiterung der Bestimmung des
inneren Sinnes, d.i.# ein Fortgang in der Zeit, die Gegenstände mögen
sein, welche sie wollen, Erscheinungen, oder reine Anschauungen.
Dieser Fortgang in der Zeit bestimmt alles, und ist an sich selbst
durch nichts weiter bestimmt: d.i.# die Teile desselben sind nur in
der Zeit, und durch die Synthesis derselben, sie aber nicht vor ihr
gegeben. Um deswillen ist ein jeder Übergang in der Wahrnehmung zu
etwas, was in der Zeit folgt, eine Bestimmung der Zeit durch die
Erzeugung dieser Wahrnehmung, und da jene, immer und in allen ihren
Teilen, eine Größe ist, die Erzeugung einer Wahrnehmung als einer
Größe durch alle Grade, deren keiner der kleinste ist, von dem Zero
an, bis zu ihrem bestimmten Grad. Hieraus erhellt nun die Möglichkeit,
ein Gesetz der Veränderungen, ihrer Form nach, a priori zu erkennen.
Wir antizipieren nur unsere eigene Apprehension, deren formale
Bedingung, da sie uns vor aller gegebenen Erscheinung selbst beiwohnt,
allerdings a priori muß erkannt werden können."
125,"So ist demnach, ebenso, wie die Zeit die sinnliche Bedingung a
priori von der Möglichkeit eines kontinuierlichen Fortganges des
Existierenden zu dem Folgenden enthält, der Verstand, vermittelst der
Einheit der Apperzeption, die Bedingung a priori der Möglichkeit einer
kontinuierlichen Bestimmung aller Stellen für die Erscheinungen in
dieser Zeit, durch die Reihe von Ursachen und Wirkungen, deren die
ersteren der letzteren ihr Dasein unausbleiblich nach sich ziehen, und
dadurch die empirische Erkenntnis der Zeitverhältnisse für jede Zeit
(allgemein) mithin objektiv gültig machen."
126,Dritte Analogie.
127,"Grundsatz des Zugleichseins, nach dem Gesetze der Wechselwirkung, oder
Gemeinschaft."
128,"Alle Substanzen, sofern sie im Raume, als zugleich wahrgenommen werden
können, sind in durchgängiger Wechselwirkung."
129,"Zugleich sind Dinge, wenn in der empirischen Anschauung die
Wahrnehmung des einen auf die Wahrnehmung des anderen wechselseitig
folgen kann, (welches in der Zeitfolge der Erscheinungen, wie beim
zweiten Grundsatze gezeigt, worden, nicht geschehen kann). So kann ich
meine Wahrnehmung zuerst am Monde, und nachher an der Erde, oder auch
umgekehrt zuerst an der Erde und dann am Monde anstellen und darum,
weil die Wahrnehmungen dieser Gegenstände einander wechselseitig
folgen können, sage ich, sie existieren zugleich. Nun ist das
Zugleichsein die Existenz des Mannigfaltigen in derselben Zeit. Man
kann aber die Zeit selbst nicht wahrnehmen, um daraus, daß Dinge
in derselben Zeit gesetzt sind, abzunehmen, daß die Wahrnehmungen
derselben einander wechselseitig folgen können. Die Synthesis der
Einbildungskraft in der Apprehension würde also nur eine jede dieser
Wahrnehmungen als eine solche angeben, die im Subjekte da ist, wenn
die andere nicht ist, und wechselsweise, nicht aber daß die Objekte
zugleich seien, d.i.# wenn das eine ist, das andere auch in derselben
Zeit sei, und daß dieses notwendig sei, damit die Wahrnehmungen
wechselseitig aufeinander folgen können. Folglich wird ein
Verstandesbegriff von der wechselseitigen Folge der Bestimmungen
dieser außer einander zugleich existierenden Dinge erfordert, um zu
sagen, daß die wechselseitige Folge der Wahrnehmungen im Objekte
gegründet sei, und das Zugleichsein dadurch als objektiv vorzustellen.
Nun ist aber das Verhältnis der Substanzen, in welchem die eine
Bestimmungen enthält, wovon der Grund in der anderen enthalten ist,
das Verhältnis des Einflusses, und, wenn wechselseitig dieses den
Grund der Bestimmungen in dem anderen enthält, das Verhältnis der
Gemeinschaft oder Wechselwirkung. Also kann das Zugleichsein der
Substanzen im Raume nicht anders in der Erfahrung erkannt werden, als
unter Voraussetzung einer Wechselwirkung derselben untereinander;
diese ist also auch die Bedingung der Möglichkeit der Dinge selbst als
Gegenstände der Erfahrung."
130,"Dinge sind zugleich, sofern sie in einer und derselben Zeit
existieren. Woran erkennt man aber: daß sie in einer und derselben
Zeit sind? Wenn die Ordnung in der Synthesis der Apprehension dieses
Mannigfaltigen gleichgültig ist, d.i.# von A durch B, C, D auf E, oder
auch umgekehrt von E zu A gehen kann. Denn, wäre sie in der Zeit
nacheinander (in der Ordnung, die von A anhebt, und in E endigt), so
ist es unmöglich, die Apprehension in der Wahrnehmung von E anzuheben,
und rückwärts zu A fortzugehen, weil A zur vergangenen Zeit gehört,
und also kein Gegenstand der Apprehension mehr sein kann."
131,"Nehmet nun an: in einer Mannigfaltigkeit von Substanzen als
Erscheinungen wäre jede derselben völlig isoliert, d.i.# keine wirkte
in die andere, und empfinge von dieser wechselseitig Einflüsse,
so sage ich: daß das Zugleichsein derselben kein Gegenstand einer
möglichen Wahrnehmung sein würde, und daß das Dasein der einen, durch
keinen Weg der empirischen Synthesis, auf das Dasein der anderen
führen könnte. Denn, wenn ihr euch gedenkt, sie wären durch einen
völlig leeren Raum getrennt, so würde die Wahrnehmung, die von der
einen zur anderen in der Zeit fortgeht, zwar dieser ihr Dasein,
vermittelst einer folgenden Wahrnehmung bestimmen, aber nicht
unterscheiden können, ob die Erscheinung objektiv auf die erstere
folge, oder mit jener vielmehr zugleich sei."
132,"Es muß also noch außer dem bloßen Dasein etwas sein, wodurch A dem B
seine Stelle in der Zeit bestimmt, und umgekehrt auch wiederum B dem
A, weil nur unter dieser Bedingung gedachte Substanzen, als zugleich
existierend, empirisch vorgestellt werden können. Nun bestimmt nur
dasjenige dem anderen seine Stelle in der Zeit, was die Ursache von
ihm oder seinen Bestimmungen ist. Also muß jede Substanz (da sie
nur in Ansehung ihrer Bestimmungen Folge sein kann) die Kausalität
gewisser Bestimmungen in der anderen, und zugleich die Wirkungen von
der Kausalität der anderen in sich enthalten, d.i.# sie müssen in
dynamischer Gemeinschaft (unmittelbar oder mittelbar) stehen, wenn das
Zugleichsein in irgendeiner möglichen Erfahrung erkannt werden soll.
Nun ist aber alles dasjenige in Ansehung der Gegenstände der Erfahrung
notwendig, ohne welches die Erfahrung von diesen Gegenständen selbst
unmöglich sein würde. Also ist es allen Substanzen in der Erscheinung,
sofern sie zugleich sind, notwendig, in durchgängiger Gemeinschaft der
Wechselwirkung untereinander zu stehen."
